### ISSUE TITLE
RTSP_RECONNECTING infinite loop if camera fails immediately without a timeout (Connection refused)

### ISSUE THREAD

**Issue by AlexeySa** [Motion-Project/motion#966]
0. Reviewed guide and contributing documents? (Yes/No): **Yes**
1. version [x.y.z, hash, other]: **4.2.2**
2. installed as a package or compiled from sources [deb, rpm, git, other]:  **rpm 4.2.2-2.el7** (@rpmfusion-free-updates)
3. standalone or part of third party [motion, MotionEyeOS, other]: 
4. video stream source [V4L (card or USB), net cam (mjpeg, rtsp, other), mmal]:  **rtsp**
5. hardware [x86, ARM, other]: **x86_64**
6. operating system [16.04, Stretch, etc, FreeBSD, other]: **CentOS 7.6.1810**

I have a problem. Motion Flood ACK-packet if connection is lost. Rate ~10000 packets per second. My ISP warned me about a violation. Please help me.

Reproduce:
1) Create rtsp stream on localhost.
2) Connect motion to local rtsp stream.
3) Close rtsp stream.
4) Run tcpdump and see ack-flood from motion.

Cam cfg:
```
camera_name Cam
camera_id 101
netcam_url rtsp://127.0.0.1:56855/Streaming/Channels/101
netcam_userpass login:pass
width 1280
height 720
text_left 
movie_filename Cam_%t-%v-%Y-%m-%d_%H-%M-%S
target_dir /var/www/html/cam
framerate 20
noise_tune on
noise_level 50
lightswitch_percent 50
lightswitch_frames 30
minimum_motion_frames 30
pre_capture 60
post_capture 45
movie_quality 70
movie_codec mpeg4
```

Tcpdump sample:
```
12:01:18.889876 IP localhost.56855 > localhost.49904: Flags [R.], seq 0, ack 993400106, win 0, length 0
..............E..(..@.@.j.................+cT.P.......
12:01:18.890132 IP localhost.56855 > localhost.49906: Flags [R.], seq 0, ack 993399885, win 0, length 0
..............E..(..@.@.j..................(.aP....9..
12:01:18.890327 IP localhost.56855 > localhost.49908: Flags [R.], seq 0, ack 993399621, win 0, length 0
..............E..(..@.@.j.................Dp.0P....!..
12:01:18.890629 IP localhost.56855 > localhost.49910: Flags [R.], seq 0, ack 993401342, win 0, length 0
..............E..(..@.@.j..................G..P.......
12:01:18.891270 IP localhost.56855 > localhost.49912: Flags [R.], seq 0, ack 993408603, win 0, length 0
..............E..(..@.@.j.................XG..P.......
12:01:18.891457 IP localhost.56855 > localhost.49914: Flags [R.], seq 0, ack 993408695, win 0, length 0
..............E..(..@.@.j.................|...P....e..
12:01:18.891672 IP localhost.56855 > localhost.49916: Flags [R.], seq 0, ack 993409218, win 0, length 0
..............E..(..@.@.j..................V..P...R...
12:01:18.891855 IP localhost.56855 > localhost.49918: Flags [R.], seq 0, ack 993409009, win 0, length 0
..............E..(..@.@.j.....................P.......
12:01:18.892041 IP localhost.56855 > localhost.49920: Flags [R.], seq 0, ack 993408956, win 0, length 0
..............E..(..@.@.j...................5.P...B..
```
```

**Comment by tosiara** [comment]
How do you "Create rtsp stream on localhost."?

**Comment by AlexeySa** [comment]
Ssh tunnel

**Comment by tosiara** [comment]
Is it reproducible without an ssh tunnel?

**Comment by AlexeySa** [comment]
I can’t check it without ssh tunnel :(

**Comment by tosiara** [comment]
What if this is ssh tunnel who is flooding?

**Comment by AlexeySa** [comment]
Flood begins when tunnel is broken (kill, disconnect, etc...).

**Comment by tosiara** [comment]
But if the tunnel is down - how could ACK packet leave the server and be detected by your ISP?

**Comment by tosiara** [comment]
Motion does not send any ACK packets directly.
If you do `ssh user@localhost` and execute `tcpdump -i lo` you should see packet storm like you pasted:

![image](https://user-images.githubusercontent.com/3600973/60176356-b5ea9000-981e-11e9-9d2c-4541536b468e.png)

This completely unrelated to motion

If you find a way to reproduce ACK flood without using SSH tunnel - please provide exact steps to reproduce

**Comment by AlexeySa** [comment]
Sory. See my cfg. 56855 - my rtsp port. Ssh port 22.
```
I run tcpdump -AAAA -i lo port 56855
```

p.s. My server is openvz. Provider limited ack connections for all iface. I do not know the details

**Comment by tosiara** [comment]
I tried to setup RTSP stream over SSH tunnel. As soon as I disconnect RTSP I see some packets every 2 seconds, trying to re-establish the connection. But not 10000 per second:

![image](https://user-images.githubusercontent.com/3600973/60177148-d1ef3100-9820-11e9-89d0-d1fe9e0bf95c.png)

And if I read correctly:

localhost.56855 > localhost.49908: Flags [R.],

localhost.56855 - your local port with forward to RTSP
localhost.49908 - motion connected to RTSP
localhost.56855 > localhost.49908: Flags [R.], - means your RTSP remote peer sends RESET to motion

Why do you think it is motion sends that RESET packet?

**Comment by AlexeySa** [comment]
strace motion (after ssh tunnel disconnect):
```
[pid 14777] getsockopt(7, SOL_SOCKET, SO_ERROR,  <unfinished ...>
[pid 14743] <... nanosleep resumed> 0x7fa5fd349a80) = 0
[pid 14777] <... getsockopt resumed> [111], [4]) = 0
[pid 14743] nanosleep({0, 46925000},  <unfinished ...>
[pid 14777] close(7)                    = 0
[pid 14777] socket(AF_INET, SOCK_STREAM|SOCK_CLOEXEC, IPPROTO_TCP) = 7
[pid 14777] fcntl(7, F_GETFL)           = 0x2 (flags O_RDWR)
[pid 14777] fcntl(7, F_SETFL, O_RDWR|O_NONBLOCK) = 0
[pid 14777] connect(7, {sa_family=AF_INET, sin_port=htons(56855), sin_addr=inet_addr("127.0.0.1")}, 16) = -1 EINPROGRESS (Operation now in progress)
[pid 14777] poll([{fd=7, events=POLLOUT}], 1, 100) = 1 ([{fd=7, revents=POLLOUT|POLLERR|POLLHUP}])
[pid 14777] getsockopt(7, SOL_SOCKET, SO_ERROR, [111], [4]) = 0
[pid 14777] close(7)                    = 0
[pid 14777] socket(AF_INET, SOCK_STREAM|SOCK_CLOEXEC, IPPROTO_TCP) = 7
[pid 14777] fcntl(7, F_GETFL)           = 0x2 (flags O_RDWR)
[pid 14777] fcntl(7, F_SETFL, O_RDWR|O_NONBLOCK) = 0
[pid 14777] connect(7, {sa_family=AF_INET, sin_port=htons(56855), sin_addr=inet_addr("127.0.0.1")}, 16) = -1 EINPROGRESS (Operation now in progress)
[pid 14777] poll([{fd=7, events=POLLOUT}], 1, 100) = 1 ([{fd=7, revents=POLLOUT|POLLERR|POLLHUP}])
[pid 14777] getsockopt(7, SOL_SOCKET, SO_ERROR, [111], [4]) = 0
[pid 14777] close(7)                    = 0
[pid 14777] socket(AF_INET, SOCK_STREAM|SOCK_CLOEXEC, IPPROTO_TCP) = 7
[pid 14777] fcntl(7, F_GETFL)           = 0x2 (flags O_RDWR)
[pid 14777] fcntl(7, F_SETFL, O_RDWR|O_NONBLOCK) = 0
[pid 14777] connect(7, {sa_family=AF_INET, sin_port=htons(56855), sin_addr=inet_addr("127.0.0.1")}, 16) = -1 EINPROGRESS (Operation now in progress)
[pid 14777] poll([{fd=7, events=POLLOUT}], 1, 100) = 1 ([{fd=7, revents=POLLOUT|POLLERR|POLLHUP}])
[pid 14777] getsockopt(7, SOL_SOCKET, SO_ERROR, [111], [4]) = 0
[pid 14777] close(7)                    = 0
[pid 14777] socket(AF_INET, SOCK_STREAM|SOCK_CLOEXEC, IPPROTO_TCP) = 7
[pid 14777] fcntl(7, F_GETFL)           = 0x2 (flags O_RDWR)
[pid 14777] fcntl(7, F_SETFL, O_RDWR|O_NONBLOCK) = 0
[pid 14777] connect(7, {sa_family=AF_INET, sin_port=htons(56855), sin_addr=inet_addr("127.0.0.1")}, 16) = -1 EINPROGRESS (Operation now in progress)
[pid 14777] poll([{fd=7, events=POLLOUT}], 1, 100) = 1 ([{fd=7, revents=POLLOUT|POLLERR|POLLHUP}])
[pid 14777] getsockopt(7, SOL_SOCKET, SO_ERROR, [111], [4]) = 0
[pid 14777] close(7)                    = 0
[pid 14777] socket(AF_INET, SOCK_STREAM|SOCK_CLOEXEC, IPPROTO_TCP) = 7
[pid 14777] fcntl(7, F_GETFL)           = 0x2 (flags O_RDWR)
[pid 14777] fcntl(7, F_SETFL, O_RDWR|O_NONBLOCK) = 0
[pid 14777] connect(7, {sa_family=AF_INET, sin_port=htons(56855), sin_addr=inet_addr("127.0.0.1")}, 16) = -1 EINPROGRESS (Operation now in progress)
[pid 14777] poll([{fd=7, events=POLLOUT}], 1, 100) = 1 ([{fd=7, revents=POLLOUT|POLLERR|POLLHUP}])
[pid 14777] getsockopt(7, SOL_SOCKET, SO_ERROR, [111], [4]) = 0
[pid 14777] close(7)                    = 0
[pid 14777] socket(AF_INET, SOCK_STREAM|SOCK_CLOEXEC, IPPROTO_TCP) = 7
[pid 14777] fcntl(7, F_GETFL)           = 0x2 (flags O_RDWR)
[pid 14777] fcntl(7, F_SETFL, O_RDWR|O_NONBLOCK) = 0
[pid 14777] connect(7, {sa_family=AF_INET, sin_port=htons(56855), sin_addr=inet_addr("127.0.0.1")}, 16) = -1 EINPROGRESS (Operation now in progress)
[pid 14777] poll([{fd=7, events=POLLOUT}], 1, 100) = 1 ([{fd=7, revents=POLLOUT|POLLERR|POLLHUP}])
[pid 14777] getsockopt(7, SOL_SOCKET, SO_ERROR, [111], [4]) = 0
[pid 14777] close(7)                    = 0
[pid 14777] socket(AF_INET, SOCK_STREAM|SOCK_CLOEXEC, IPPROTO_TCP) = 7
[pid 14777] fcntl(7, F_GETFL)           = 0x2 (flags O_RDWR)
[pid 14777] fcntl(7, F_SETFL, O_RDWR|O_NONBLOCK) = 0
[pid 14777] connect(7, {sa_family=AF_INET, sin_port=htons(56855), sin_addr=inet_addr("127.0.0.1")}, 16) = -1 EINPROGRESS (Operation now in progress)
[pid 14777] poll([{fd=7, events=POLLOUT}], 1, 100) = 1 ([{fd=7, revents=POLLOUT|POLLERR|POLLHUP}])
[pid 14777] getsockopt(7, SOL_SOCKET, SO_ERROR, [111], [4]) = 0
[pid 14777] close(7)                    = 0
[pid 14777] socket(AF_INET, SOCK_STREAM|SOCK_CLOEXEC, IPPROTO_TCP) = 7
[pid 14777] fcntl(7, F_GETFL)           = 0x2 (flags O_RDWR)
[pid 14777] fcntl(7, F_SETFL, O_RDWR|O_NONBLOCK) = 0
[pid 14777] connect(7, {sa_family=AF_INET, sin_port=htons(56855), sin_addr=inet_addr("127.0.0.1")}, 16) = -1 EINPROGRESS (Operation now in progress)
[pid 14777] poll([{fd=7, events=POLLOUT}], 1, 100) = 1 ([{fd=7, revents=POLLOUT|POLLERR|POLLHUP}])
[pid 14777] getsockopt(7, SOL_SOCKET, SO_ERROR, [111], [4]) = 0
[pid 14777] close(7)                    = 0
[pid 14777] socket(AF_INET, SOCK_STREAM|SOCK_CLOEXEC, IPPROTO_TCP) = 7
[pid 14777] fcntl(7, F_GETFL)           = 0x2 (flags O_RDWR)
[pid 14777] fcntl(7, F_SETFL, O_RDWR|O_NONBLOCK) = 0
[pid 14777] connect(7, {sa_family=AF_INET, sin_port=htons(56855), sin_addr=inet_addr("127.0.0.1")}, 16) = -1 EINPROGRESS (Operation now in progress)
[pid 14777] poll([{fd=7, events=POLLOUT}], 1, 100) = 1 ([{fd=7, revents=POLLOUT|POLLERR|POLLHUP}])
[pid 14777] getsockopt(7, SOL_SOCKET, SO_ERROR, [111], [4]) = 0
[pid 14777] close(7)                    = 0
[pid 14777] socket(AF_INET, SOCK_STREAM|SOCK_CLOEXEC, IPPROTO_TCP) = 7
[pid 14777] fcntl(7, F_GETFL)           = 0x2 (flags O_RDWR)
[pid 14777] fcntl(7, F_SETFL, O_RDWR|O_NONBLOCK) = 0
[pid 14777] connect(7, {sa_family=AF_INET, sin_port=htons(56855), sin_addr=inet_addr("127.0.0.1")}, 16) = -1 EINPROGRESS (Operation now in progress)
[pid 14777] poll([{fd=7, events=POLLOUT}], 1, 100) = 1 ([{fd=7, revents=POLLOUT|POLLERR|POLLHUP}])
[pid 14777] getsockopt(7, SOL_SOCKET, SO_ERROR, [111], [4]) = 0
[pid 14777] close(7)                    = 0
[pid 14777] socket(AF_INET, SOCK_STREAM|SOCK_CLOEXEC, IPPROTO_TCP) = 7
[pid 14777] fcntl(7, F_GETFL)           = 0x2 (flags O_RDWR)
[pid 14777] fcntl(7, F_SETFL, O_RDWR|O_NONBLOCK) = 0
[pid 14777] connect(7, {sa_family=AF_INET, sin_port=htons(56855), sin_addr=inet_addr("127.0.0.1")}, 16) = -1 EINPROGRESS (Operation now in progress)
[pid 14777] poll([{fd=7, events=POLLOUT}], 1, 100) = 1 ([{fd=7, revents=POLLOUT|POLLERR|POLLHUP}])
[pid 14777] getsockopt(7, SOL_SOCKET, SO_ERROR, [111], [4]) = 0
[pid 14777] close(7)                    = 0
[pid 14777] socket(AF_INET, SOCK_STREAM|SOCK_CLOEXEC, IPPROTO_TCP) = 7
[pid 14777] fcntl(7, F_GETFL)           = 0x2 (flags O_RDWR)
[pid 14777] fcntl(7, F_SETFL, O_RDWR|O_NONBLOCK) = 0
[pid 14777] connect(7, {sa_family=AF_INET, sin_port=htons(56855), sin_addr=inet_addr("127.0.0.1")}, 16) = -1 EINPROGRESS (Operation now in progress)
[pid 14777] poll([{fd=7, events=POLLOUT}], 1, 100) = 1 ([{fd=7, revents=POLLOUT|POLLERR|POLLHUP}])
[pid 14777] getsockopt(7, SOL_SOCKET, SO_ERROR, [111], [4]) = 0
[pid 14777] close(7)                    = 0
[pid 14777] socket(AF_INET, SOCK_STREAM|SOCK_CLOEXEC, IPPROTO_TCP) = 7
[pid 14777] fcntl(7, F_GETFL)           = 0x2 (flags O_RDWR)
[pid 14777] fcntl(7, F_SETFL, O_RDWR|O_NONBLOCK) = 0
[pid 14777] connect(7, {sa_family=AF_INET, sin_port=htons(56855), sin_addr=inet_addr("127.0.0.1")}, 16) = -1 EINPROGRESS (Operation now in progress)
[pid 14777] poll([{fd=7, events=POLLOUT}], 1, 100) = 1 ([{fd=7, revents=POLLOUT|POLLERR|POLLHUP}])
[pid 14777] getsockopt(7, SOL_SOCKET, SO_ERROR, [111], [4]) = 0
[pid 14777] close(7)                    = 0
[pid 14777] socket(AF_INET, SOCK_STREAM|SOCK_CLOEXEC, IPPROTO_TCP) = 7
[pid 14777] fcntl(7, F_GETFL)           = 0x2 (flags O_RDWR)
[pid 14777] fcntl(7, F_SETFL, O_RDWR|O_NONBLOCK) = 0
[pid 14777] connect(7, {sa_family=AF_INET, sin_port=htons(56855), sin_addr=inet_addr("127.0.0.1")}, 16) = -1 EINPROGRESS (Operation now in progress)
[pid 14777] poll([{fd=7, events=POLLOUT}], 1, 100) = 1 ([{fd=7, revents=POLLOUT|POLLERR|POLLHUP}])
[pid 14777] getsockopt(7, SOL_SOCKET, SO_ERROR, [111], [4]) = 0
[pid 14777] close(7)                    = 0
[pid 14777] socket(AF_INET, SOCK_STREAM|SOCK_CLOEXEC, IPPROTO_TCP) = 7
[pid 14777] fcntl(7, F_GETFL)           = 0x2 (flags O_RDWR)
[pid 14777] fcntl(7, F_SETFL, O_RDWR|O_NONBLOCK) = 0
[pid 14777] connect(7, {sa_family=AF_INET, sin_port=htons(56855), sin_addr=inet_addr("127.0.0.1")}, 16) = -1 EINPROGRESS (Operation now in progress)
[pid 14777] poll([{fd=7, events=POLLOUT}], 1, 100) = 1 ([{fd=7, revents=POLLOUT|POLLERR|POLLHUP}])
[pid 14777] getsockopt(7, SOL_SOCKET, SO_ERROR, [111], [4]) = 0
[pid 14777] close(7)                    = 0
[pid 14777] socket(AF_INET, SOCK_STREAM|SOCK_CLOEXEC, IPPROTO_TCP) = 7
[pid 14777] fcntl(7, F_GETFL)           = 0x2 (flags O_RDWR)
[pid 14777] fcntl(7, F_SETFL, O_RDWR|O_NONBLOCK) = 0
[pid 14777] connect(7, {sa_family=AF_INET, sin_port=htons(56855), sin_addr=inet_addr("127.0.0.1")}, 16) = -1 EINPROGRESS (Operation now in progress)
[pid 14777] poll([{fd=7, events=POLLOUT}], 1, 100) = 1 ([{fd=7, revents=POLLOUT|POLLERR|POLLHUP}])
[pid 14777] getsockopt(7, SOL_SOCKET, SO_ERROR, [111], [4]) = 0
[pid 14777] close(7)                    = 0
[pid 14777] socket(AF_INET, SOCK_STREAM|SOCK_CLOEXEC, IPPROTO_TCP) = 7
[pid 14777] fcntl(7, F_GETFL)           = 0x2 (flags O_RDWR)
[pid 14777] fcntl(7, F_SETFL, O_RDWR|O_NONBLOCK) = 0
[pid 14777] connect(7, {sa_family=AF_INET, sin_port=htons(56855), sin_addr=inet_addr("127.0.0.1")}, 16) = -1 EINPROGRESS (Operation now in progress)
[pid 14777] poll([{fd=7, events=POLLOUT}], 1, 100) = 1 ([{fd=7, revents=POLLOUT|POLLERR|POLLHUP}])
[pid 14777] getsockopt(7, SOL_SOCKET, SO_ERROR, [111], [4]) = 0
[pid 14777] close(7)                    = 0
[pid 14777] socket(AF_INET, SOCK_STREAM|SOCK_CLOEXEC, IPPROTO_TCP) = 7
[pid 14777] fcntl(7, F_GETFL)           = 0x2 (flags O_RDWR)
[pid 14777] fcntl(7, F_SETFL, O_RDWR|O_NONBLOCK) = 0
[pid 14777] connect(7, {sa_family=AF_INET, sin_port=htons(56855), sin_addr=inet_addr("127.0.0.1")}, 16) = -1 EINPROGRESS (Operation now in progress)
[pid 14777] poll([{fd=7, events=POLLOUT}], 1, 100) = 1 ([{fd=7, revents=POLLOUT|POLLERR|POLLHUP}])
[pid 14777] getsockopt(7, SOL_SOCKET, SO_ERROR, [111], [4]) = 0
[pid 14777] close(7)                    = 0
[pid 14777] socket(AF_INET, SOCK_STREAM|SOCK_CLOEXEC, IPPROTO_TCP) = 7
[pid 14777] fcntl(7, F_GETFL)           = 0x2 (flags O_RDWR)
[pid 14777] fcntl(7, F_SETFL, O_RDWR|O_NONBLOCK) = 0
[pid 14777] connect(7, {sa_family=AF_INET, sin_port=htons(56855), sin_addr=inet_addr("127.0.0.1")}, 16) = -1 EINPROGRESS (Operation now in progress)
[pid 14777] poll([{fd=7, events=POLLOUT}], 1, 100) = 1 ([{fd=7, revents=POLLOUT|POLLERR|POLLHUP}])
[pid 14777] getsockopt(7, SOL_SOCKET, SO_ERROR, [111], [4]) = 0
[pid 14777] close(7)                    = 0
[pid 14777] socket(AF_INET, SOCK_STREAM|SOCK_CLOEXEC, IPPROTO_TCP) = 7
[pid 14777] fcntl(7, F_GETFL)           = 0x2 (flags O_RDWR)
[pid 14777] fcntl(7, F_SETFL, O_RDWR|O_NONBLOCK) = 0
[pid 14777] connect(7, {sa_family=AF_INET, sin_port=htons(56855), sin_addr=inet_addr("127.0.0.1")}, 16) = -1 EINPROGRESS (Operation now in progress)
[pid 14777] poll([{fd=7, events=POLLOUT}], 1, 100) = 1 ([{fd=7, revents=POLLOUT|POLLERR|POLLHUP}])
[pid 14777] getsockopt(7, SOL_SOCKET, SO_ERROR, [111], [4]) = 0
[pid 14777] close(7)                    = 0
[pid 14777] socket(AF_INET, SOCK_STREAM|SOCK_CLOEXEC, IPPROTO_TCP) = 7
[pid 14777] fcntl(7, F_GETFL)           = 0x2 (flags O_RDWR)
[pid 14777] fcntl(7, F_SETFL, O_RDWR|O_NONBLOCK) = 0
[pid 14777] connect(7, {sa_family=AF_INET, sin_port=htons(56855), sin_addr=inet_addr("127.0.0.1")}, 16) = -1 EINPROGRESS (Operation now in progress)
[pid 14777] poll([{fd=7, events=POLLOUT}], 1, 100) = 1 ([{fd=7, revents=POLLOUT|POLLERR|POLLHUP}])
[pid 14777] getsockopt(7, SOL_SOCKET, SO_ERROR, [111], [4]) = 0
[pid 14777] close(7)                    = 0
[pid 14777] socket(AF_INET, SOCK_STREAM|SOCK_CLOEXEC, IPPROTO_TCP) = 7
[pid 14777] fcntl(7, F_GETFL)           = 0x2 (flags O_RDWR)
[pid 14777] fcntl(7, F_SETFL, O_RDWR|O_NONBLOCK) = 0
[pid 14777] connect(7, {sa_family=AF_INET, sin_port=htons(56855), sin_addr=inet_addr("127.0.0.1")}, 16) = -1 EINPROGRESS (Operation now in progress)
[pid 14777] poll([{fd=7, events=POLLOUT}], 1, 100) = 1 ([{fd=7, revents=POLLOUT|POLLERR|POLLHUP}])
[pid 14777] getsockopt(7, SOL_SOCKET, SO_ERROR, [111], [4]) = 0
[pid 14777] close(7)                    = 0
[pid 14777] socket(AF_INET, SOCK_STREAM|SOCK_CLOEXEC, IPPROTO_TCP) = 7
[pid 14777] fcntl(7, F_GETFL)           = 0x2 (flags O_RDWR)
[pid 14777] fcntl(7, F_SETFL, O_RDWR|O_NONBLOCK) = 0
[pid 14777] connect(7, {sa_family=AF_INET, sin_port=htons(56855), sin_addr=inet_addr("127.0.0.1")}, 16) = -1 EINPROGRESS (Operation now in progress)
[pid 14777] poll([{fd=7, events=POLLOUT}], 1, 100) = 1 ([{fd=7, revents=POLLOUT|POLLERR|POLLHUP}])
[pid 14777] getsockopt(7, SOL_SOCKET, SO_ERROR, [111], [4]) = 0
[pid 14777] close(7)                    = 0
[pid 14777] socket(AF_INET, SOCK_STREAM|SOCK_CLOEXEC, IPPROTO_TCP) = 7
[pid 14777] fcntl(7, F_GETFL)           = 0x2 (flags O_RDWR)
[pid 14777] fcntl(7, F_SETFL, O_RDWR|O_NONBLOCK) = 0
[pid 14777] connect(7, {sa_family=AF_INET, sin_port=htons(56855), sin_addr=inet_addr("127.0.0.1")}, 16) = -1 EINPROGRESS (Operation now in progress)
[pid 14777] poll([{fd=7, events=POLLOUT}], 1, 100) = 1 ([{fd=7, revents=POLLOUT|POLLERR|POLLHUP}])
[pid 14777] getsockopt(7, SOL_SOCKET, SO_ERROR, [111], [4]) = 0
[pid 14777] close(7)                    = 0
[pid 14777] socket(AF_INET, SOCK_STREAM|SOCK_CLOEXEC, IPPROTO_TCP) = 7
[pid 14777] fcntl(7, F_GETFL)           = 0x2 (flags O_RDWR)
[pid 14777] fcntl(7, F_SETFL, O_RDWR|O_NONBLOCK) = 0
[pid 14777] connect(7, {sa_family=AF_INET, sin_port=htons(56855), sin_addr=inet_addr("127.0.0.1")}, 16) = -1 EINPROGRESS (Operation now in progress)
[pid 14777] poll([{fd=7, events=POLLOUT}], 1, 100) = 1 ([{fd=7, revents=POLLOUT|POLLERR|POLLHUP}])
[pid 14777] getsockopt(7, SOL_SOCKET, SO_ERROR, [111], [4]) = 0
[pid 14777] close(7)                    = 0
[pid 14777] socket(AF_INET, SOCK_STREAM|SOCK_CLOEXEC, IPPROTO_TCP) = 7
[pid 14777] fcntl(7, F_GETFL)           = 0x2 (flags O_RDWR)
[pid 14777] fcntl(7, F_SETFL, O_RDWR|O_NONBLOCK) = 0
[pid 14777] connect(7, {sa_family=AF_INET, sin_port=htons(56855), sin_addr=inet_addr("127.0.0.1")}, 16) = -1 EINPROGRESS (Operation now in progress)
[pid 14777] poll([{fd=7, events=POLLOUT}], 1, 100) = 1 ([{fd=7, revents=POLLOUT|POLLERR|POLLHUP}])
[pid 14777] getsockopt(7, SOL_SOCKET, SO_ERROR, [111], [4]) = 0
[pid 14777] close(7)                    = 0
[pid 14777] socket(AF_INET, SOCK_STREAM|SOCK_CLOEXEC, IPPROTO_TCP) = 7
[pid 14777] fcntl(7, F_GETFL)           = 0x2 (flags O_RDWR)
[pid 14777] fcntl(7, F_SETFL, O_RDWR|O_NONBLOCK) = 0
[pid 14777] connect(7, {sa_family=AF_INET, sin_port=htons(56855), sin_addr=inet_addr("127.0.0.1")}, 16) = -1 EINPROGRESS (Operation now in progress)
[pid 14777] poll([{fd=7, events=POLLOUT}], 1, 100) = 1 ([{fd=7, revents=POLLOUT|POLLERR|POLLHUP}])
[pid 14777] getsockopt(7, SOL_SOCKET, SO_ERROR, [111], [4]) = 0
[pid 14777] close(7)                    = 0
[pid 14777] socket(AF_INET, SOCK_STREAM|SOCK_CLOEXEC, IPPROTO_TCP) = 7
[pid 14777] fcntl(7, F_GETFL)           = 0x2 (flags O_RDWR)
[pid 14777] fcntl(7, F_SETFL, O_RDWR|O_NONBLOCK) = 0
[pid 14777] connect(7, {sa_family=AF_INET, sin_port=htons(56855), sin_addr=inet_addr("127.0.0.1")}, 16) = -1 EINPROGRESS (Operation now in progress)
[pid 14777] poll([{fd=7, events=POLLOUT}], 1, 100) = 1 ([{fd=7, revents=POLLOUT|POLLERR|POLLHUP}])
[pid 14777] getsockopt(7, SOL_SOCKET, SO_ERROR, [111], [4]) = 0
[pid 14777] close(7)                    = 0
[pid 14777] socket(AF_INET, SOCK_STREAM|SOCK_CLOEXEC, IPPROTO_TCP) = 7
[pid 14777] fcntl(7, F_GETFL)           = 0x2 (flags O_RDWR)
[pid 14777] fcntl(7, F_SETFL, O_RDWR|O_NONBLOCK) = 0
[pid 14777] connect(7, {sa_family=AF_INET, sin_port=htons(56855), sin_addr=inet_addr("127.0.0.1")}, 16) = -1 EINPROGRESS (Operation now in progress)
[pid 14777] poll([{fd=7, events=POLLOUT}], 1, 100) = 1 ([{fd=7, revents=POLLOUT|POLLERR|POLLHUP}])
[pid 14777] getsockopt(7, SOL_SOCKET, SO_ERROR, [111], [4]) = 0
[pid 14777] close(7)                    = 0
[pid 14777] socket(AF_INET, SOCK_STREAM|SOCK_CLOEXEC, IPPROTO_TCP) = 7
[pid 14777] fcntl(7, F_GETFL)           = 0x2 (flags O_RDWR)
[pid 14777] fcntl(7, F_SETFL, O_RDWR|O_NONBLOCK) = 0
[pid 14777] connect(7, {sa_family=AF_INET, sin_port=htons(56855), sin_addr=inet_addr("127.0.0.1")}, 16) = -1 EINPROGRESS (Operation now in progress)
[pid 14777] poll([{fd=7, events=POLLOUT}], 1, 100) = 1 ([{fd=7, revents=POLLOUT|POLLERR|POLLHUP}])
[pid 14777] getsockopt(7, SOL_SOCKET, SO_ERROR, [111], [4]) = 0
[pid 14777] close(7)                    = 0
[pid 14777] socket(AF_INET, SOCK_STREAM|SOCK_CLOEXEC, IPPROTO_TCP) = 7
[pid 14777] fcntl(7, F_GETFL)           = 0x2 (flags O_RDWR)
[pid 14777] fcntl(7, F_SETFL, O_RDWR|O_NONBLOCK) = 0
[pid 14777] connect(7, {sa_family=AF_INET, sin_port=htons(56855), sin_addr=inet_addr("127.0.0.1")}, 16) = -1 EINPROGRESS (Operation now in progress)
[pid 14777] poll([{fd=7, events=POLLOUT}], 1, 100) = 1 ([{fd=7, revents=POLLOUT|POLLERR|POLLHUP}])
[pid 14777] getsockopt(7, SOL_SOCKET, SO_ERROR, [111], [4]) = 0
[pid 14777] close(7)                    = 0
[pid 14777] socket(AF_INET, SOCK_STREAM|SOCK_CLOEXEC, IPPROTO_TCP) = 7
[pid 14777] fcntl(7, F_GETFL)           = 0x2 (flags O_RDWR)
[pid 14777] fcntl(7, F_SETFL, O_RDWR|O_NONBLOCK) = 0
[pid 14777] connect(7, {sa_family=AF_INET, sin_port=htons(56855), sin_addr=inet_addr("127.0.0.1")}, 16) = -1 EINPROGRESS (Operation now in progress)
[pid 14777] poll([{fd=7, events=POLLOUT}], 1, 100) = 1 ([{fd=7, revents=POLLOUT|POLLERR|POLLHUP}])
[pid 14777] getsockopt(7, SOL_SOCKET, SO_ERROR, [111], [4]) = 0
[pid 14777] close(7 <unfinished ...>
[pid 14743] <... nanosleep resumed> 0x7fa5fd349a80) = 0
[pid 14777] <... close resumed> )       = 0
[pid 14743] nanosleep({0, 46605000},  <unfinished ...>
[pid 14777] socket(AF_INET, SOCK_STREAM|SOCK_CLOEXEC, IPPROTO_TCP) = 7
[pid 14777] fcntl(7, F_GETFL)           = 0x2 (flags O_RDWR)
[pid 14777] fcntl(7, F_SETFL, O_RDWR|O_NONBLOCK) = 0
[pid 14777] connect(7, {sa_family=AF_INET, sin_port=htons(56855), sin_addr=inet_addr("127.0.0.1")}, 16) = -1 EINPROGRESS (Operation now in progress)
[pid 14777] poll([{fd=7, events=POLLOUT}], 1, 100) = 1 ([{fd=7, revents=POLLOUT|POLLERR|POLLHUP}])
[pid 14777] getsockopt(7, SOL_SOCKET, SO_ERROR, [111], [4]) = 0
[pid 14777] close(7)                    = 0
[pid 14777] socket(AF_INET, SOCK_STREAM|SOCK_CLOEXEC, IPPROTO_TCP) = 7
[pid 14777] fcntl(7, F_GETFL)           = 0x2 (flags O_RDWR)
[pid 14777] fcntl(7, F_SETFL, O_RDWR|O_NONBLOCK) = 0
[pid 14777] connect(7, {sa_family=AF_INET, sin_port=htons(56855), sin_addr=inet_addr("127.0.0.1")}, 16) = -1 EINPROGRESS (Operation now in progress)
[pid 14777] poll([{fd=7, events=POLLOUT}], 1, 100) = 1 ([{fd=7, revents=POLLOUT|POLLERR|POLLHUP}])
[pid 14777] getsockopt(7, SOL_SOCKET, SO_ERROR, [111], [4]) = 0
[pid 14777] close(7)                    = 0
[pid 14777] socket(AF_INET, SOCK_STREAM|SOCK_CLOEXEC, IPPROTO_TCP) = 7
[pid 14777] fcntl(7, F_GETFL)           = 0x2 (flags O_RDWR)
[pid 14777] fcntl(7, F_SETFL, O_RDWR|O_NONBLOCK) = 0
[pid 14777] connect(7, {sa_family=AF_INET, sin_port=htons(56855), sin_addr=inet_addr("127.0.0.1")}, 16) = -1 EINPROGRESS (Operation now in progress)
[pid 14777] poll([{fd=7, events=POLLOUT}], 1, 100) = 1 ([{fd=7, revents=POLLOUT|POLLERR|POLLHUP}])
[pid 14777] getsockopt(7, SOL_SOCKET, SO_ERROR, [111], [4]) = 0
[pid 14777] close(7)                    = 0
[pid 14777] socket(AF_INET, SOCK_STREAM|SOCK_CLOEXEC, IPPROTO_TCP) = 7
[pid 14777] fcntl(7, F_GETFL)           = 0x2 (flags O_RDWR)
[pid 14777] fcntl(7, F_SETFL, O_RDWR|O_NONBLOCK) = 0
[pid 14777] connect(7, {sa_family=AF_INET, sin_port=htons(56855), sin_addr=inet_addr("127.0.0.1")}, 16) = -1 EINPROGRESS (Operation now in progress)
[pid 14777] poll([{fd=7, events=POLLOUT}], 1, 100) = 1 ([{fd=7, revents=POLLOUT|POLLERR|POLLHUP}])
[pid 14777] getsockopt(7, SOL_SOCKET, SO_ERROR, [111], [4]) = 0
[pid 14777] close(7)                    = 0
[pid 14777] socket(AF_INET, SOCK_STREAM|SOCK_CLOEXEC, IPPROTO_TCP) = 7
[pid 14777] fcntl(7, F_GETFL)           = 0x2 (flags O_RDWR)
[pid 14777] fcntl(7, F_SETFL, O_RDWR|O_NONBLOCK) = 0
[pid 14777] connect(7, {sa_family=AF_INET, sin_port=htons(56855), sin_addr=inet_addr("127.0.0.1")}, 16) = -1 EINPROGRESS (Operation now in progress)
[pid 14777] poll([{fd=7, events=POLLOUT}], 1, 100) = 1 ([{fd=7, revents=POLLOUT|POLLERR|POLLHUP}])
[pid 14777] getsockopt(7, SOL_SOCKET, SO_ERROR, [111], [4]) = 0
[pid 14777] close(7)                    = 0
[pid 14777] socket(AF_INET, SOCK_STREAM|SOCK_CLOEXEC, IPPROTO_TCP) = 7
[pid 14777] fcntl(7, F_GETFL)           = 0x2 (flags O_RDWR)
[pid 14777] fcntl(7, F_SETFL, O_RDWR|O_NONBLOCK) = 0
[pid 14777] connect(7, {sa_family=AF_INET, sin_port=htons(56855), sin_addr=inet_addr("127.0.0.1")}, 16) = -1 EINPROGRESS (Operation now in progress)
[pid 14777] poll([{fd=7, events=POLLOUT}], 1, 100) = 1 ([{fd=7, revents=POLLOUT|POLLERR|POLLHUP}])
[pid 14777] getsockopt(7, SOL_SOCKET, SO_ERROR, [111], [4]) = 0
[pid 14777] close(7)                    = 0
[pid 14777] socket(AF_INET, SOCK_STREAM|SOCK_CLOEXEC, IPPROTO_TCP) = 7
[pid 14777] fcntl(7, F_GETFL)           = 0x2 (flags O_RDWR)
[pid 14777] fcntl(7, F_SETFL, O_RDWR|O_NONBLOCK) = 0
[pid 14777] connect(7, {sa_family=AF_INET, sin_port=htons(56855), sin_addr=inet_addr("127.0.0.1")}, 16) = -1 EINPROGRESS (Operation now in progress)
[pid 14777] poll([{fd=7, events=POLLOUT}], 1, 100) = 1 ([{fd=7, revents=POLLOUT|POLLERR|POLLHUP}])
[pid 14777] getsockopt(7, SOL_SOCKET, SO_ERROR, [111], [4]) = 0
[pid 14777] close(7)                    = 0
[pid 14777] socket(AF_INET, SOCK_STREAM|SOCK_CLOEXEC, IPPROTO_TCP) = 7
[pid 14777] fcntl(7, F_GETFL)           = 0x2 (flags O_RDWR)
[pid 14777] fcntl(7, F_SETFL, O_RDWR|O_NONBLOCK) = 0
[pid 14777] connect(7, {sa_family=AF_INET, sin_port=htons(56855), sin_addr=inet_addr("127.0.0.1")}, 16) = -1 EINPROGRESS (Operation now in progress)
[pid 14777] poll([{fd=7, events=POLLOUT}], 1, 100) = 1 ([{fd=7, revents=POLLOUT|POLLERR|POLLHUP}])
[pid 14777] getsockopt(7, SOL_SOCKET, SO_ERROR, [111], [4]) = 0
[pid 14777] close(7)                    = 0
[pid 14777] socket(AF_INET, SOCK_STREAM|SOCK_CLOEXEC, IPPROTO_TCP) = 7
[pid 14777] fcntl(7, F_GETFL)           = 0x2 (flags O_RDWR)
[pid 14777] fcntl(7, F_SETFL, O_RDWR|O_NONBLOCK) = 0
[pid 14777] connect(7, {sa_family=AF_INET, sin_port=htons(56855), sin_addr=inet_addr("127.0.0.1")}, 16) = -1 EINPROGRESS (Operation now in progress)
[pid 14777] poll([{fd=7, events=POLLOUT}], 1, 100) = 1 ([{fd=7, revents=POLLOUT|POLLERR|POLLHUP}])
[pid 14777] getsockopt(7, SOL_SOCKET, SO_ERROR, [111], [4]) = 0
[pid 14777] close(7)                    = 0
[pid 14777] socket(AF_INET, SOCK_STREAM|SOCK_CLOEXEC, IPPROTO_TCP) = 7
[pid 14777] fcntl(7, F_GETFL)           = 0x2 (flags O_RDWR)
[pid 14777] fcntl(7, F_SETFL, O_RDWR|O_NONBLOCK) = 0
[pid 14777] connect(7, {sa_family=AF_INET, sin_port=htons(56855), sin_addr=inet_addr("127.0.0.1")}, 16) = -1 EINPROGRESS (Operation now in progress)
[pid 14777] poll([{fd=7, events=POLLOUT}], 1, 100) = 1 ([{fd=7, revents=POLLOUT|POLLERR|POLLHUP}])
[pid 14777] getsockopt(7, SOL_SOCKET, SO_ERROR, [111], [4]) = 0
[pid 14777] close(7)                    = 0
[pid 14777] socket(AF_INET, SOCK_STREAM|SOCK_CLOEXEC, IPPROTO_TCP) = 7
[pid 14777] fcntl(7, F_GETFL)           = 0x2 (flags O_RDWR)
[pid 14777] fcntl(7, F_SETFL, O_RDWR|O_NONBLOCK) = 0
[pid 14777] connect(7, {sa_family=AF_INET, sin_port=htons(56855), sin_addr=inet_addr("127.0.0.1")}, 16) = -1 EINPROGRESS (Operation now in progress)
[pid 14777] poll([{fd=7, events=POLLOUT}], 1, 100) = 1 ([{fd=7, revents=POLLOUT|POLLERR|POLLHUP}])
[pid 14777] getsockopt(7, SOL_SOCKET, SO_ERROR, [111], [4]) = 0
[pid 14777] close(7)                    = 0
[pid 14777] socket(AF_INET, SOCK_STREAM|SOCK_CLOEXEC, IPPROTO_TCP) = 7
[pid 14777] fcntl(7, F_GETFL)           = 0x2 (flags O_RDWR)
[pid 14777] fcntl(7, F_SETFL, O_RDWR|O_NONBLOCK) = 0
[pid 14777] connect(7, {sa_family=AF_INET, sin_port=htons(56855), sin_addr=inet_addr("127.0.0.1")}, 16) = -1 EINPROGRESS (Operation now in progress)
[pid 14777] poll([{fd=7, events=POLLOUT}], 1, 100) = 1 ([{fd=7, revents=POLLOUT|POLLERR|POLLHUP}])
[pid 14777] getsockopt(7, SOL_SOCKET, SO_ERROR, [111], [4]) = 0
[pid 14777] close(7)                    = 0
[pid 14777] socket(AF_INET, SOCK_STREAM|SOCK_CLOEXEC, IPPROTO_TCP) = 7
[pid 14777] fcntl(7, F_GETFL)           = 0x2 (flags O_RDWR)
[pid 14777] fcntl(7, F_SETFL, O_RDWR|O_NONBLOCK) = 0
[pid 14777] connect(7, {sa_family=AF_INET, sin_port=htons(56855), sin_addr=inet_addr("127.0.0.1")}, 16) = -1 EINPROGRESS (Operation now in progress)
[pid 14777] poll([{fd=7, events=POLLOUT}], 1, 100) = 1 ([{fd=7, revents=POLLOUT|POLLERR|POLLHUP}])
[pid 14777] getsockopt(7, SOL_SOCKET, SO_ERROR, [111], [4]) = 0
[pid 14777] close(7)                    = 0
[pid 14777] socket(AF_INET, SOCK_STREAM|SOCK_CLOEXEC, IPPROTO_TCP) = 7
[pid 14777] fcntl(7, F_GETFL)           = 0x2 (flags O_RDWR)
[pid 14777] fcntl(7, F_SETFL, O_RDWR|O_NONBLOCK) = 0
[pid 14777] connect(7, {sa_family=AF_INET, sin_port=htons(56855), sin_addr=inet_addr("127.0.0.1")}, 16) = -1 EINPROGRESS (Operation now in progress)
[pid 14777] poll([{fd=7, events=POLLOUT}], 1, 100) = 1 ([{fd=7, revents=POLLOUT|POLLERR|POLLHUP}])
[pid 14777] getsockopt(7, SOL_SOCKET, SO_ERROR, [111], [4]) = 0
[pid 14777] close(7)
```

**Comment by tosiara** [comment]
Maybe you are using some custom motion build, but this is what I get when tunnel disconnects:

![image](https://user-images.githubusercontent.com/3600973/60181657-5ba3fc00-982b-11e9-9a94-f7d5528aa9b6.png)

You will have to be very specific with steps as I cannot reproduce the issue

**Comment by AlexeySa** [comment]
I use motion 4.2.2. RPM spec https://github.com/rpmfusion/motion

**Comment by AlexeySa** [comment]
Motion is not detect lost connection for my rtsp stream.
For example:
1) kill ssh connection
2) curl http://127.0.0.1:18080/101/detection/connection
```Camera Cam
Camera 101 -- Cam Connection OK```

**Comment by tosiara** [comment]
Probably that is because motion is still connected to the localhost address and is waiting for frames to come. Is it reporting connection ok forever? Or does it detect disconnect in 1 or 2 minutes?

**Comment by AlexeySa** [comment]
I am tested. Motion detect disconnect camera ~20 seconds.
```
# curl http://127.0.0.1:18080/101/detection/connection
Camera Cam
Camera 101 -- Cam1 Lost connection
```
ack flood does not stopped :(

Flood stopped after: ```curl http://127.0.0.1:18080/101/action/restart```

I temporarily solved the problem by adding to the config:
```on_camera_lost curl -s http://127.0.0.1:18080/101/action/restart &> /dev/null```

I think there is a problem in motion code.

**Comment by tosiara** [comment]
Please start motion with the highest logging `-d 9`, reproduce the issue, wait till connection to camera is lost, your script restarts the detection and everything becomes fine. Then kill motion, zip the log and upload here

**Comment by AlexeySa** [comment]
**Normal connect:**

```
[1:ml1:Cam] [NTC] [ALL] motion_init: Camera 101 started: motion detection Enabled
[1:ml1:Cam] [NTC] [VID] vid_start: Opening Netcam RTSP
[1:ml1:Cam] [INF] [NET] netcam_rtsp_set_parms: Setting up Normal resolution stream.
[1:ml1:Cam] [INF] [NET] netcam_rtsp_set_path: Setting up rtsp via ffmpeg netcam
[1:ml1:Cam] [INF] [NET] netcam_rtsp_set_rtsp: Normal resolution: Setting rtsp transport to tcp
[1:ml1:Cam] [INF] [NET] netcam_rtsp_open_context: Normal resolution: Opened camera(Cam)
[1:ml1:Cam] [INF] [ENC] ffmpeg_avcodec_log: deprecated pixel format used, make sure you did set range correctly
[1:ml1:Cam] [DBG] [NET] netcam_check_buffsize: expanding buffer from [0/0] to [0/1384448] bytes.
[1:ml1:Cam] [DBG] [NET] Above message repeats 1 times
[1:ml1:Cam] [DBG] [NET] netcam_check_buffsize: expanding buffer from [1382400/1384448] to [1382400/2764800] bytes.
[1:ml1:Cam] [NTC] [NET] netcam_rtsp_connect: Normal resolution: Camera (Cam) connected
[1:ml1:Cam] [DBG] [NET] netcam_check_buffsize: expanding buffer from [1382400/1384448] to [1382400/2764800] bytes.
[1:ml1:Cam] [NTC] [ALL] image_ring_resize: Resizing pre_capture buffer to 1 items
[2:nc2:Cam] [NTC] [NET] netcam_rtsp_handler: Normal resolution: Camera handler thread [2] started
[2:nc2:Cam] [INF] [NET] netcam_rtsp_open_context: Normal resolution: Opened camera(Cam)
[2:nc2:Cam] [INF] [ENC] ffmpeg_avcodec_log: deprecated pixel format used, make sure you did set range correctly
[2:nc2:Cam] [NTC] [NET] netcam_rtsp_connect: Normal resolution: Camera (Cam) connected
[1:ml1:Cam] [NTC] [ALL] image_ring_resize: Resizing pre_capture buffer to 90 items
```


**After kill ssh tunnel:**

!!! Above message repeats 5000 times !!!

```
[2:nc2:Cam] [INF] [NET] netcam_rtsp_read_image: Normal resolution: av_read_frame: End of file ,Interrupt: False
[2:nc2:Cam] [ERR] [NET] netcam_rtsp_handler_reconnect: Normal resolution: Reconnecting with camera....
[2:nc2:Cam] [INF] [ENC] ffmpeg_avcodec_log: Connection to tcp://127.0.0.1:56855?timeout=0 failed: Connection refused
[2:nc2:Cam] [INF] [ENC] Above message repeats 5000 times
[2:nc2:Cam] [INF] [ENC] ffmpeg_avcodec_log: Connection to tcp://127.0.0.1:56855?timeout=0 failed: Connection refused
[2:nc2:Cam] [INF] [ENC] Above message repeats 5000 times
[2:nc2:Cam] [INF] [ENC] ffmpeg_avcodec_log: Connection to tcp://127.0.0.1:56855?timeout=0 failed: Connection refused
[2:nc2:Cam] [INF] [ENC] Above message repeats 5000 times
[2:nc2:Cam] [INF] [ENC] ffmpeg_avcodec_log: Connection to tcp://127.0.0.1:56855?timeout=0 failed: Connection refused
[2:nc2:Cam] [INF] [ENC] Above message repeats 5000 times
[2:nc2:Cam] [INF] [ENC] ffmpeg_avcodec_log: Connection to tcp://127.0.0.1:56855?timeout=0 failed: Connection refused
[2:nc2:Cam] [INF] [ENC] Above message repeats 5000 times
[2:nc2:Cam] [INF] [ENC] ffmpeg_avcodec_log: Connection to tcp://127.0.0.1:56855?timeout=0 failed: Connection refused
[2:nc2:Cam] [INF] [ENC] Above message repeats 5000 times
[2:nc2:Cam] [INF] [ENC] ffmpeg_avcodec_log: Connection to tcp://127.0.0.1:56855?timeout=0 failed: Connection refused
[2:nc2:Cam] [INF] [ENC] Above message repeats 5000 times
[2:nc2:Cam] [INF] [ENC] ffmpeg_avcodec_log: Connection to tcp://127.0.0.1:56855?timeout=0 failed: Connection refused
[2:nc2:Cam] [INF] [ENC] Above message repeats 5000 times
[2:nc2:Cam] [INF] [ENC] ffmpeg_avcodec_log: Connection to tcp://127.0.0.1:56855?timeout=0 failed: Connection refused
[2:nc2:Cam] [INF] [ENC] Above message repeats 5000 times
[2:nc2:Cam] [INF] [ENC] ffmpeg_avcodec_log: Connection to tcp://127.0.0.1:56855?timeout=0 failed: Connection refused
[2:nc2:Cam] [INF] [ENC] Above message repeats 5000 times
[2:nc2:Cam] [INF] [ENC] ffmpeg_avcodec_log: Connection to tcp://127.0.0.1:56855?timeout=0 failed: Connection refused
[2:nc2:Cam] [INF] [ENC] Above message repeats 5000 times
[2:nc2:Cam] [INF] [ENC] ffmpeg_avcodec_log: Connection to tcp://127.0.0.1:56855?timeout=0 failed: Connection refused
[2:nc2:Cam] [INF] [ENC] Above message repeats 5000 times
[2:nc2:Cam] [INF] [ENC] ffmpeg_avcodec_log: Connection to tcp://127.0.0.1:56855?timeout=0 failed: Connection refused
[2:nc2:Cam] [INF] [ENC] Above message repeats 5000 times
[2:nc2:Cam] [INF] [ENC] ffmpeg_avcodec_log: Connection to tcp://127.0.0.1:56855?timeout=0 failed: Connection refused
[2:nc2:Cam] [INF] [ENC] Above message repeats 5000 times
[2:nc2:Cam] [INF] [ENC] ffmpeg_avcodec_log: Connection to tcp://127.0.0.1:56855?timeout=0 failed: Connection refused
[2:nc2:Cam] [INF] [ENC] Above message repeats 5000 times
[2:nc2:Cam] [INF] [ENC] ffmpeg_avcodec_log: Connection to tcp://127.0.0.1:56855?timeout=0 failed: Connection refused
[2:nc2:Cam] [INF] [ENC] Above message repeats 5000 times
[2:nc2:Cam] [INF] [ENC] ffmpeg_avcodec_log: Connection to tcp://127.0.0.1:56855?timeout=0 failed: Connection refused
[2:nc2:Cam] [INF] [ENC] Above message repeats 5000 times
[2:nc2:Cam] [INF] [ENC] ffmpeg_avcodec_log: Connection to tcp://127.0.0.1:56855?timeout=0 failed: Connection refused
[2:nc2:Cam] [INF] [ENC] Above message repeats 5000 times
[2:nc2:Cam] [INF] [ENC] ffmpeg_avcodec_log: Connection to tcp://127.0.0.1:56855?timeout=0 failed: Connection refused
[2:nc2:Cam] [INF] [ENC] Above message repeats 5000 times
[2:nc2:Cam] [INF] [ENC] ffmpeg_avcodec_log: Connection to tcp://127.0.0.1:56855?timeout=0 failed: Connection refused
[2:nc2:Cam] [INF] [ENC] Above message repeats 5000 times
[2:nc2:Cam] [INF] [ENC] ffmpeg_avcodec_log: Connection to tcp://127.0.0.1:56855?timeout=0 failed: Connection refused
[2:nc2:Cam] [INF] [ENC] Above message repeats 5000 times
[2:nc2:Cam] [INF] [ENC] ffmpeg_avcodec_log: Connection to tcp://127.0.0.1:56855?timeout=0 failed: Connection refused
[2:nc2:Cam] [INF] [ENC] Above message repeats 5000 times
[2:nc2:Cam] [INF] [ENC] ffmpeg_avcodec_log: Connection to tcp://127.0.0.1:56855?timeout=0 failed: Connection refused
[2:nc2:Cam] [INF] [ENC] Above message repeats 5000 times
[2:nc2:Cam] [INF] [ENC] ffmpeg_avcodec_log: Connection to tcp://127.0.0.1:56855?timeout=0 failed: Connection refused
[2:nc2:Cam] [INF] [ENC] Above message repeats 5000 times
[2:nc2:Cam] [INF] [ENC] ffmpeg_avcodec_log: Connection to tcp://127.0.0.1:56855?timeout=0 failed: Connection refused
[2:nc2:Cam] [INF] [ENC] Above message repeats 5000 times
[2:nc2:Cam] [INF] [ENC] ffmpeg_avcodec_log: Connection to tcp://127.0.0.1:56855?timeout=0 failed: Connection refused
[2:nc2:Cam] [INF] [ENC] Above message repeats 5000 times
[2:nc2:Cam] [INF] [ENC] ffmpeg_avcodec_log: Connection to tcp://127.0.0.1:56855?timeout=0 failed: Connection refused
[2:nc2:Cam] [INF] [ENC] Above message repeats 5000 times
[2:nc2:Cam] [INF] [ENC] ffmpeg_avcodec_log: Connection to tcp://127.0.0.1:56855?timeout=0 failed: Connection refused
[2:nc2:Cam] [INF] [ENC] Above message repeats 5000 times
[2:nc2:Cam] [INF] [ENC] ffmpeg_avcodec_log: Connection to tcp://127.0.0.1:56855?timeout=0 failed: Connection refused
[2:nc2:Cam] [INF] [ENC] Above message repeats 5000 times
[2:nc2:Cam] [INF] [ENC] ffmpeg_avcodec_log: Connection to tcp://127.0.0.1:56855?timeout=0 failed: Connection refused
[2:nc2:Cam] [INF] [ENC] Above message repeats 5000 times
[2:nc2:Cam] [INF] [ENC] ffmpeg_avcodec_log: Connection to tcp://127.0.0.1:56855?timeout=0 failed: Connection refused
[2:nc2:Cam] [INF] [ENC] Above message repeats 5000 times
[2:nc2:Cam] [INF] [ENC] ffmpeg_avcodec_log: Connection to tcp://127.0.0.1:56855?timeout=0 failed: Connection refused
[2:nc2:Cam] [INF] [ENC] Above message repeats 5000 times
[2:nc2:Cam] [INF] [ENC] ffmpeg_avcodec_log: Connection to tcp://127.0.0.1:56855?timeout=0 failed: Connection refused
[2:nc2:Cam] [INF] [ENC] Above message repeats 5000 times
[2:nc2:Cam] [INF] [ENC] ffmpeg_avcodec_log: Connection to tcp://127.0.0.1:56855?timeout=0 failed: Connection refused
[2:nc2:Cam] [INF] [ENC] Above message repeats 5000 times
[2:nc2:Cam] [INF] [ENC] ffmpeg_avcodec_log: Connection to tcp://127.0.0.1:56855?timeout=0 failed: Connection refused
[2:nc2:Cam] [INF] [ENC] Above message repeats 5000 times
[2:nc2:Cam] [INF] [ENC] ffmpeg_avcodec_log: Connection to tcp://127.0.0.1:56855?timeout=0 failed: Connection refused
[2:nc2:Cam] [INF] [ENC] Above message repeats 5000 times
[2:nc2:Cam] [INF] [ENC] ffmpeg_avcodec_log: Connection to tcp://127.0.0.1:56855?timeout=0 failed: Connection refused
[2:nc2:Cam] [INF] [ENC] Above message repeats 5000 times
[2:nc2:Cam] [INF] [ENC] ffmpeg_avcodec_log: Connection to tcp://127.0.0.1:56855?timeout=0 failed: Connection refused
[2:nc2:Cam] [INF] [ENC] Above message repeats 5000 times
[2:nc2:Cam] [INF] [ENC] ffmpeg_avcodec_log: Connection to tcp://127.0.0.1:56855?timeout=0 failed: Connection refused
[2:nc2:Cam] [INF] [ENC] Above message repeats 5000 times
[2:nc2:Cam] [INF] [ENC] ffmpeg_avcodec_log: Connection to tcp://127.0.0.1:56855?timeout=0 failed: Connection refused
[2:nc2:Cam] [INF] [ENC] Above message repeats 5000 times
[2:nc2:Cam] [INF] [ENC] ffmpeg_avcodec_log: Connection to tcp://127.0.0.1:56855?timeout=0 failed: Connection refused
[2:nc2:Cam] [INF] [NET] Above message repeats 3975 times
```

**After start ssh tunnel:**
```
[2:nc2:Cam] [INF] [NET] netcam_rtsp_open_context: Normal resolution: Opened camera(Cam)
[2:nc2:Cam] [INF] [ENC] ffmpeg_avcodec_log: deprecated pixel format used, make sure you did set range correctly
[2:nc2:Cam] [NTC] [NET] netcam_rtsp_connect: Normal resolution: Camera (Cam) connected
```

**Comment by tosiara** [comment]
Believe me, I really do need full logs
Please start motion with the highest logging -d 9, reproduce the issue, wait till connection to camera is lost, your script restarts the detection and everything becomes fine. Then kill motion, zip the log and upload here

**Comment by AlexeySa** [comment]
Sorry. I am attached full log.
[motion.zip](https://github.com/Motion-Project/motion/files/3338385/motion.zip)

Times:
11:54:30 - created ssh tunnel
11:54:54 - started ```motion -n -d 9```
11:54:55-11:54:57 - motion successfully connected to rtsp
11:55:29 - kill ssh connection.
11:55:30 - motion put to log "Reconnecting with camera...."
11:55:30 - 11:56:00 - motion flood reconnections.
11:56:00 - motion auto exec script "on_camera_lost"
11:56:00 - 11:56:50 - motion normally reconnecting with pauses between repetitions
11:56:47 - start ssh tunnel 
 11:56:50 - motion successfully connected to rtsp

**Comment by tosiara** [comment]
Now I reproduced it and will try to analyze what is happening
```
[2:nc2:Cam] [INF] [NET] netcam_rtsp_read_image: Normal resolution: av_read_frame: End of file ,Interrupt: False
[2:nc2:Cam] [ERR] [NET] netcam_rtsp_handler_reconnect: Normal resolution: Reconnecting with camera....
[2:nc2:Cam] [INF] [ENC] ffmpeg_avcodec_log: Connection to tcp://127.0.0.1:56855?timeout=0 failed: Connection refused
[2:nc2:Cam] [INF] [ENC] Above message repeats 5000 times
[2:nc2:Cam] [INF] [ENC] ffmpeg_avcodec_log: Connection to tcp://127.0.0.1:56855?timeout=0 failed: Connection refused
[2:nc2:Cam] [INF] [ENC] Above message repeats 5000 times
[2:nc2:Cam] [INF] [ENC] ffmpeg_avcodec_log: Connection to tcp://127.0.0.1:56855?timeout=0 failed: Connection refused
[2:nc2:Cam] [INF] [ENC] Above message repeats 5000 times
[2:nc2:Cam] [INF] [ENC] ffmpeg_avcodec_log: Connection to tcp://127.0.0.1:56855?timeout=0 failed: Connection refused
[2:nc2:Cam] [INF] [ENC] Above message repeats 5000 times
[2:nc2:Cam] [INF] [ENC] ffmpeg_avcodec_log: Connection to tcp://127.0.0.1:56855?timeout=0 failed: Connection refused
[2:nc2:Cam] [INF] [ENC] Above message repeats 5000 times
[2:nc2:Cam] [INF] [ENC] ffmpeg_avcodec_log: Connection to tcp://127.0.0.1:56855?timeout=0 failed: Connection refused
[2:nc2:Cam] [INF] [ENC] Above message repeats 5000 times
[2:nc2:Cam] [INF] [ENC] ffmpeg_avcodec_log: Connection to tcp://127.0.0.1:56855?timeout=0 failed: Connection refused
[2:nc2:Cam] [INF] [ENC] Above message repeats 5000 times
[2:nc2:Cam] [INF] [ENC] ffmpeg_avcodec_log: Connection to tcp://127.0.0.1:56855?timeout=0 failed: Connection refused
[2:nc2:Cam] [INF] [ENC] Above message repeats 5000 times
[2:nc2:Cam] [INF] [ENC] ffmpeg_avcodec_log: Connection to tcp://127.0.0.1:56855?timeout=0 failed: Connection refused
[1:ml1:Cam] [NTC] [ALL] Above message repeats 479 times
[1:ml1:Cam] [NTC] [ALL] mlp_actions: End of event 1
```

**Comment by tosiara** [comment]
RTSP_RECONNECTING strategy must be reviewed
Currently it will try to reconnect forever without a delay. In case you are connecting to localhost and you get immediate "Connection refused" (RST packet) the timing is microseconds so camera will retry thousands times per second causing syslog flood as well as high CPU usage
Maybe some counter needed or a hardcoded delay between retries

**Comment by Mr-Dave** [comment]
closed via #983
